,isEdited,rating,date,review,userName,title
1673,False,5,2019-06-23 18:33:39,"I’ve been using the app to order for a long time. It’s easy, user friendly and I really like the interface. It’s so easy to order, amend your basket etc",kfig1,Always great
1674,False,3,2019-10-20 14:42:20,"ASOS app is great and easy to use. The back in stock notifications are also really useful. However, when something goes wrong, the experience at ASOS is extremely bad, I have never experienced customer service quite so awful.",75CA,Love the app - shame about the Customer Service
1675,False,5,2018-12-30 10:01:36,"Good filters , easy to navigate , great pictures of the products and the best thing - items are saved for an hour when I’m shopping bag 😃",shopmad69,ASOS website
1676,False,4,2019-01-05 17:46:55,"Spanish version only gives Spanish language as an option. 
Would be much more accessible for customers who’s Spanish aren’t good enough to use. As Spain is in Europe the option for English & French should at least be available.",EllieJJJJ,Solo idioma español
1677,False,5,2018-09-01 00:41:04,I can always find something that little bit different at ASOS. Quality is good & prices reasonable l definitely recommend ASOS.,Dennydjhaz,Always able to find something
1678,False,4,2018-12-16 09:25:54,"I love ASOS dresses, especially their own range, i know if i order a size 12, it will fit. I love being able to filter on the website; so much choice and great designs; im proud to own multiple dresses now, was always a jeans and ‘nice’ top prior to discovering ASOS.",Fenetra,Great website and brand
1679,False,4,2018-09-15 12:27:46,have no bad things to say apart from things go out of stock very fast for example one day every size will be in stock then the next day only one size is available,toosherooner,Love it but things are always out of stock
1680,False,5,2018-08-17 19:40:32,Love this app. It is my go to place for EVERYTHING. The only thing it is missing is the super useful size recommendations you get on the website.,LizzyC80,Great app but wish it had the size recommendations
1681,False,5,2018-06-17 09:54:48,Love the APP! Best bit accessing all my saved items with ease and not having to enter any details every time I buy - which is all the time 👍,Pinkvic,Couldn’t Shop Without!
1682,False,5,2018-06-11 16:55:05,"I’ve been using ASOS for several years now. I never fail to find something I love & whenever I wear the clothes my friends comment on how nice they are. Fair prices, great sales, easy returns, & a brilliant loyalty points scheme. Gotta Love ASOS!! 😍",Clairech0,My Go-To site
1683,False,5,2018-06-01 11:48:22,One of the best app for quick choosing and paying trendy items! New option to pay after your tried items on 👍🏻,Kuba888,Good app
1684,False,5,2018-05-02 20:22:11,"ASOS is the first thing I think of when browsing for clothes as you can literally get everything! The app is very easy to use , the only negative I have is that there is sooooo much choice I get bored of endlessly scrolling!",B0wls,GREAT BUT TOOOOO MUCH CHOICE!!?!
1685,False,5,2018-02-25 10:18:11,One of the widest selections I’ve seen in an app. Very good options for slightly alternative. Brilliant price range and quality. Very good bang for your buck. Professional shipping. VERY appealing layout. I don’t really have a bad thing to say to be honest,Gonbochab,Great
1686,False,5,2018-01-06 00:39:11,So easy to use best clothing app and so convenient. Too easy to pay I can’t stop shopping and I have the next day delivery as well so it’s leaving me skint and homeless,Tegiewegiewooty,Use all for fun not even to shop
1687,False,3,2018-02-14 23:11:32,"Wow! I never expected to find affordable Jordan clothing for my son at Asos.  Yet, it’s here, with some great discounts and the newest lines out too.
   I stopped shopping at Asos for a while, but since returning I have benefited from the new fashion lines, reasonable prices & excellent reward scheme. It’s great to be back and to benefit from my loyalty.",Peggy16,Extended clothing variety
1688,False,5,2017-11-21 07:28:28,"Christmas shopping galore! With the online offers I can get so much more for my money it’s amazing!
Great free delivery and the reward system is brilliant .... even more off my purchases!",HeatherPayne,Always on point!
1689,False,5,2017-10-30 19:51:27,"Takes a minute to load but once it's on and loaded it's easy to use.

Should be special offers for those who use the app 😊",LK_123,Works on my iPhone!
1690,False,5,2017-10-02 23:57:04,"Never been a big fan of online shopping but asos makes it so easy! The app is the best on the market, there's so much choice of clothes to pick from 🕺🏼",liamjlivesey,This is the future
1691,False,5,2017-09-10 16:48:33,Absolutely love this app. So easy to find and order what I want. Even better that I paid £9.99 for unlimited next day delivery. Always my first choice when shopping for clothing ❤️,Clare_xx,Great app
1692,False,5,2017-09-05 15:22:03,"Love the app, only suggestion would be to have the size recommendations that you get on the desktop website which would be really helpful.",Davs83,Great app...
1693,False,5,2022-11-28 18:28:16,Brilliant customer service team well done thank you for your help 😊,pierec,Customer service
1694,False,5,2022-06-01 14:55:02,ASOS is amazing a lot of their competitors could learn so much from this company they do everything right seriously their service is the best it’s efficient effective effortless!,ls10 4,Amazing
1695,False,5,2022-03-22 20:41:59,Great service always get my purchases really quick . Never any problems ☺️,cesjones2502,Purchases
1696,False,5,2022-01-11 11:23:12,"I don’t go anywhere else to shop. So easy to use. Literally, my entire wardrobe is from asos. Premier delivery is a steal. You really don’t need to go anywhere else.",PeaWhizz,Asos
1697,False,1,2022-02-22 18:27:33,I’d never use this website again sent the wrong items couldn’t get the orders correctly & my stuff went missing absolutely disgusting & staff thorough customer service where terribly rude & annoying I will be deleting this app & never using this website again after all the inconvenience!!!!!!!!,stacey clarke xx,Worst website I’ve ever used
1698,False,5,2021-12-21 11:59:44,"Thank you for existing! I love the next day delivery, even if is around £5 the postage, it worth especially when I am busy and I can’t go out to do shopping! Love ASOS 🤗❤️",Carmen Foia,Love it
1699,False,4,2022-01-09 09:55:26,Overall ASOS is great especially for someone like myself who is exploring loads of outfit choices and fashion choices! Literally have every style available to shop and browse!,Aaronium,Regular Customer
1700,False,5,2021-11-20 14:43:35,"I love this app. Easy to find things and put in the basket or to the chosen section. Easy to order, return and track your order. Great app.",sally071,Love this app
1701,False,5,2021-09-14 17:00:28,"I got the app with the promise of 20% of first order but wasn’t available to use at checkout 
Very disappointed",slch 77,Not happy
1702,False,5,2021-07-21 21:05:06,"Apparently this isn’t a thing anymore. After having ASOS for years, and a regular customer, I don’t understand now why you can’t sort next day delivery anymore, always 2 days. Just a joke having to wait for products longer than your advertising.",LouLouGrey67,Next day delivery
1703,False,5,2021-06-13 18:39:10,"Could not love this site any more than I already do, the clothes are brilliant, well described and true to size not to mention lovely! Excellently packaged and speedy deliver *sighs* ASOS makes me so happy!! 😍",Lee Wendo,My lockdown saviour!!
1704,False,5,2021-02-22 14:41:18,"Absolutely love the ASOS app, perfect way of fuelling my addiction with the “back in stock” notifications. Definitely helped them stay in business over lockdown(s). Thanks ASOS - 10/10.",Lorrazzle,10/10 ESPECIALLY FOR PETITE
1705,False,3,2021-04-23 08:22:36,The items in the basket time out quickly so you have to go back and add at the end when making a large order which is annoying,CJb123455789,Order time out
1706,False,5,2021-01-11 16:16:28,I have been using this app for over 2 years and absolutely love shopping here. It’s so effortless.,shivzi1125,Shopping made effortless and a lot more exciting
1707,False,5,2020-11-29 00:15:24,Love the ASOS app. Love it even more now they’ve introduced star ratings for products too & info about whether items run small or large!,kels3eagreene,Never had a problem!
1708,False,5,2020-11-23 19:34:54,"Loved the styles to choose from and then having the option to pay over 3 instalments was a no brainer , and then a discount was cherry on top !",Netty 68,Coat for my daughter
1709,False,5,2020-11-03 18:09:58,"I don’t know why but I would never go near ASOS until recently and I’m annoyed I didn’t use it sooner, very cheap and stylish clothing in here. Lots of different styles to pick from too.",NozzBOSS,Impressed
1710,False,5,2020-11-02 19:58:56,"Easy to use.  Good choice of items with good pictures & some videos. No problems ordering or paying. All in all, a hassle free way to shop.",Gigijix,Easy to use App
1711,False,5,2020-09-20 17:27:17,"The best selection of contemporary & stylish clothing for curvy girls! What a breath of fresh air to find a website that uses real plus size models to show you what the clothes actually look like! 
 Thanks goodness for ASOS",SJWBristol64,Curves
1712,False,5,2020-06-27 22:27:34,"ASOS has been my go to online shop for everything! From gifts and clothes for any occasion, to swimwear I love it! Can’t get enough of it! It’s so easy to browse, purchase and return. The best e-commerce out there!",s-rowley,Fabulous
1713,False,5,2020-05-24 12:17:11,I use ASOS as my go to online retailer. I don’t use anyone else anymore as I can find all my wants and needs here ! ASOS design is my favourite brand as the clothes as great long lasting quality and reasonably priced.,nerual666,Customer review
1714,False,5,2020-05-15 15:01:01,This app is so easy to use. Also if you need to return anything doing it via the app makes it thé easiest out of any other site 👍🏼,xox_amy_xox,Love
1715,False,5,2020-03-15 10:21:57,"I can find everything I want easily and it takes such a short time to arrival, I’m a women’s in my 50 and find they have clothing for all ages",valsbeauty,So easy to shop
1716,False,4,2020-05-14 14:05:55,Such a good app but the notifications for restocking are false! I click the notification that says to me it’s back in my size but this is not true and I’m constantly disappointed that everything is not in my size ever!,felicia2828,Good app
1717,False,5,2020-02-29 01:02:41,Love this app! Makes for a far more enjoyable shopping experience than any physical store and makes browsing clothes easy. Can’t get enough!,Littlestubbsy,Easy to navigate and seamless
1718,False,5,2019-12-28 05:33:09,"So easy to navigate through, simple UI, great with notifications on deals, usually my go to when online shopping",Mntll yur best friend,Easily easy
1719,False,4,2019-12-12 08:01:55,Would be 5 stars if the page you’re scrolling through didn’t refresh when you left the app for a few minutes,JCS456,.
1720,False,5,2019-12-05 13:47:07,Always use the app when I want to shop on my phone. Always works well. Never come across any bugs. Definitely recommend.,dp3360,Love it
1721,False,5,2019-11-04 08:43:50,Have been shopping in this app for ages. It has never disappointed. The app is really easy to use and to find what you’re looking for. Keep it going,Freitas1210,Amazing
1722,False,4,2019-11-18 19:15:40,The app makes it easy to find and select items that you would want. I'd suggest adding more pictures of make up swatches on the skin as well as a ratings system for each product,Tardis uk,Pretty good
1723,False,5,2019-10-31 01:35:59,"It’s one of the most smooth running apps ever made I believe, very clever very easy and incredible after care service. Great brands great accessories it’s just as good as browsing Instagram!",Nooshinism,Addictive -don’t get the app
1724,False,5,2019-10-30 20:52:56,"It was better when I used to earn money when buying items 
It was promised a better scheme would replace that system 
What is it ?",WonL777,Where’s the loyalty scheme ?
1725,False,5,2019-04-22 19:05:08,It is very difficult for me to buy clothing due to my hight but I’m thoroughly enjoying selecting items from ASOS tall brand - hoping for bigger and better selection in the near future.,TallBea,Selection
1726,False,4,2019-10-11 14:55:19,"Love the ASOS app. Very frequent user! I would really like to see more interactive ability on product search pages, so you can look through item images without clicking in to the product for ease.",Natalie_K92,ASOS
1727,False,4,2019-10-03 22:16:15,Quick and easy navigation but could be better in terms of price use to have better deals in the past and sale product was good,Monzy$,Good offers
1728,False,1,2019-09-18 23:22:10,The app is working just fine but I didn’t find any where to put this review on the style and “fashion” ASOS is showing is absolutely awful and disgusting the clothing choice is so flat it just doesn’t show any beauty or good fashionable taste and every time I scroll down through the app it gets more and more yaks I just can’t understand how people are dressed this crap clothes and you call it designer label 🤦🏻‍♀️ ew really ew,superevanescence,Opinion
1729,False,5,2019-04-11 13:47:25,"I really like using this app it’s so quick, easy and efficient. It’s easy to navigate and love how easy it is to filter and find items!",maryafz,Easy and quick
1730,False,5,2018-11-24 16:19:41,"Really easy to use app, too easy. I find myself buying stuff I shouldn’t because the app is so seamless! 
My only gripe is the style of ASOS is a bit manic and not that practical",Eggseggseggschicken,Almost ~too~ easy to use
1731,False,5,2018-11-18 17:44:55,Asos always delivers on offers allowing me to be able to treat myself now and again and get more for my money :) much appreciated,Loz_tinkerbell_123,Student offers
1732,False,5,2018-11-07 16:43:47,Such a good app. Used weekly to order various items and never have any problems. Even prefer over full website.,Claireraine,Amazing
1733,False,5,2018-08-19 09:00:40,"Enough pics to see the outfit in full and LOVE the video as u can see how it looks in ‘real life’
I also love the suggestions of other outfits I’ll like -I use this function a lot",Resie_mik,Simple and effortless
1734,False,4,2018-09-09 12:43:14,"Amazing app , super convenient and clear. however where is the search bar is I want to search specific things ?? I tend to use it a lot and can’t see it anywhere in the app",laulaubons,"Great app, needs a search bar"
1735,False,5,2018-07-02 20:04:50,"When you have a filter on, you can only scroll down so far before the app stops working on iOS.... infuriating",edaffs,Filters don’t work
1736,False,3,2018-07-08 18:30:40,"Enjoy the quality of clothes and the easy access through the app. However, There was an issue with my payment that I changed and I haven’t received a refund of voucher when my order was cancelled from them.",soph_534,Good but rubbish customer service
1737,False,5,2018-05-19 11:22:12,Paid for same day delivery didn’t turn up or no notifications at all or updates emails ect was a joke all I got was a refund ( as expected),Lphi778,Shocking
1738,False,5,2018-03-04 09:25:38,The screenshot search is a revolution. It’s never been easier to look for similar or dupes of people’s clothes I’ve seen on Instagram. Love it! And super user friendly!,Gridsie,I love the screenshot search option
1739,False,3,2018-03-06 00:22:14,"A lot of your items are out of stock in size 10-12, which is probably the most popular size. Also you don’t seem to have items in the ‘complete the look’ when you see the models wearing them",Heathclifffe,Not enough things in stock
1740,False,5,2017-10-22 01:05:31,"Best value, never any issue... even late sending things back and it’s sorted! Best shopping experience around! If you don’t have premier, why not... it pays for itself in like 2 orders! Plus you get discounts! Love it! X",Ollirrrr,Yeah!!!
1741,False,5,2017-10-04 20:57:58,"Brilliant app, good to check up on your vouchers and be able to save items for 60 days. Makes browsing a lot easier. Must have !!",Lamaison90,Must Have
1742,False,5,2017-09-11 07:22:28,"Easy to use, never had any issues with performance. User friendly. Would like to see an option to filter out 'Tall / Maternity / Curve ' ranges so just normal range is filtered.",r4ch3ls2007,Go - To Shopping App
1743,False,5,2022-11-27 10:00:37,Such a wide variety of things to order and when you can use the discount codes too!! Happy days!! ☺️☺️☺️,Susie B 1406,Happy!
1744,False,3,2022-12-05 19:49:14,"I was a happy customer and would have given 5
Stars only the past few deliveries of mine have been 2/3 week’s delivery although I pay for next day delivery, so that that reason I gave a low rating this time.",GaMEr KiNg YT,My delivery
1745,False,5,2022-07-24 08:24:49,I found the app really easy to use and safe in terms of holding my data,Purdy Georgie,Very easy to use
1746,False,1,2022-09-25 11:04:41,I tried for nearly 2 hours over 2 days to order 3 items. Could not get through the checkout. Logged into customer support and after 20 minutes conversation ended! Re logged on and had to go through everything again even though with same advisor!,Grumpylady7,Technology issues soooo bad
1747,False,5,2022-05-16 20:36:22,Perfect shopping and always been delivered time they say....... just wish they didn’t use Avri delivery as they treat parcels badly … and once it never arrived for 4 days late!!,Mdjecollins,Perfect
1748,False,4,2022-07-19 20:27:49,ASOS it’s incredible with customer care but the only thing that ruins this is that there isn’t enough variety of cloths but thats only me I’m pretty sure that’s anyone else would be pretty happy with it.,Arshpreet_82,Preety good
1749,False,5,2022-04-05 19:00:14,"Been using this for a long time, it’s fab. Love the fact you can save & watch stuff & when it’s at a price that suits you can buy 💜💜💜💜",Moonshine 78,Great app
1750,False,5,2022-01-01 21:00:59,"Makes my ASOS shopping experience so much more seamless, quick and easy!",AJL 89,Super Easy and better that then using the site.
1751,False,3,2022-03-18 10:32:45,"I already bought from this app more than once, but every single order i have an issue. Or it’s the post office that they put the delivery it’s to far or it’s not in that one, or wrong size.",Diogo Enes,Nice and works well but
1752,False,5,2021-10-07 09:59:44,"Absolutely love this site! Every time fast delivery and good quality! Never had any problems with them, ordered lots of items!",rody2508,Absolutely love Asos!
1753,False,1,2021-10-21 23:25:33,I got the app then tried to order something then it charged my PayPal but the order didn’t go through. I had to wait 2 days till I got the money back it came so I tried again and then it blocked my account because it was “suspicious” I just wanted to buy something I don’t understand why it blocked,Admftfvb,This app is annoying
1754,False,5,2021-08-03 22:04:51,5 star service. Great products and always arrive on time neatly packaged. Have no complaints what do ever and have been wearing clothes from ASOS for 5 years +…,joe120497,5 stars
1755,False,5,2021-07-04 21:35:14,"Always handy for all my needs.  Great brands and brilliant products and prices 
Fantastic delivery deal and easy returns
Just as online shopping should be",gilfin,Great Store
1756,False,5,2021-07-01 20:36:07,"Super simple to spend your money, chase a return impossible",alang111,Contact us doesn’t work
1757,False,5,2021-07-01 05:00:00,ASOS has fantastic choice for the plus size person and having videos to see the clothing been worn is fantastic !,Elan321,Plus size fashion
1758,False,5,2021-06-03 08:26:24,Easy to search for something you need to find quickly or equally good to just browse. Usually good stock levels too. Delivery is reliable.,louise987123,Love ASOS
1759,False,5,2021-06-03 06:31:21,Nice things to choose from. Definitely worth getting the annual next day delivery membership. Would recommend.,seksybek,My Favourite Clothing App
1760,False,5,2021-05-11 10:02:49,"Amazing !!!
Can always find something , quite easy to use , never crashes . Defo recommend to everyone I know.",asos junky 2.0,Review
1761,False,5,2021-03-31 18:43:36,Amazing service and quick delivery on every item purchased. App is brill and so easy to use.,ALJ K,Amazing service and app very easy to use
1762,False,5,2021-03-17 11:47:19,"ASOS always been and is my favourite shopping app, the variety and options available all at one place. Full starts",Vanilllaaa,Best shopping app
1763,False,5,2021-01-16 18:01:32,Such a good and detailed shop app! Easy to choose the right garment/size!!,Littlebirdlv13,Easy to choose the right product from the first trial
1764,False,4,2021-02-26 20:37:19,"great app. only bought a few things from asos so far but i really like the way the website and app are set up because it’s easy to use. the models are kind of annoying because they pose in positions that don’t show the clothes properly, but loads of their own brand clothes are good quality, although some of their own brand stuff is delivered with a smell so be careful with that.",jazzbojames,great app with sooo many clothes for different styles
1765,False,1,2021-01-31 18:28:45,"Your company is awful! This not the second time I’ve ordered a product and received a completely different product. Contacting customer service via Live Chat is another issue. A simple query could last 20 minutes. They are slow to respond, use generic answers that are not tailored to your queries!",A$O$,Wrong product delivered
1766,False,5,2020-12-22 00:23:25,"ASOS is the best place for clothes shopping, great selection at all price points, stock tons of well known brands and the app layout itself is spectacular. Can’t fault it!",J-ps24,Best for shopping
1767,False,5,2020-12-10 11:01:51,Did all my Christmas shopping in one place. I love using ASOS especially the App. So quick easy to find what you want.,charalambos V,Easy shopping
1768,False,5,2020-08-07 12:06:30,Very happy with every item I have bought! Amazing quality and will be shopping from here all the time.,Dcnhsh,Amazing
1769,False,5,2020-04-07 14:16:14,The app doesn’t allow me to sign in just keeps asking if I’m a robot 🙁,nah ddI hb,The app doesn’t allow me to sign in just keeps asking if I’m a robot 🙁
1770,False,5,2020-02-03 20:51:14,"Just so easy to use, knows my size, great filters and so easy to return if not quite right. As a working mum it’s the only place I really shop, Thanks ASOS for keeping me on trend x",Bengie161,Love ASOS app
1771,False,5,2020-01-04 18:17:44,"Great app, easy search functionality and easy to navigate. Paired with a brilliant customer service team you couldn't ask for more.",Darrentntntntnt,Perfect
1772,False,5,2019-11-28 08:11:36,I live in Northern Ireland most next day delivery takes a couple of days. I pay the yearly so this works out fantastic .. my favourite place to shop,leanne 😊,Next day deliveries is actually next day
1773,False,5,2019-11-15 01:23:10,"Simple, efficient app which is aesthetically pleasing as well as being easy to use. Love having a range of selection and being able to heart the items I love.",RosieMarriott,Amazos
1774,False,5,2019-08-27 18:25:03,"I absolutely love shopping on ASOS as they have a variety of my favourite types of clothes. However,I am a bit sad that it takes a while to be delivered :(",Tay Jennings.,My favourite shop site !
1775,False,5,2019-03-05 08:44:36,Session timed out 3 times removing everything from bag even though I was well within hour limit. Really frustrating,gemchar81,Session kept timing out
1776,False,4,2019-08-02 12:56:11,Very easy to use only thing i would change is that it’d be great to be notified when something you have hearted/liked becomes available again,Sean Nelson (London),Easy to use
1777,False,1,2019-07-21 11:25:09,"With numerous attempts of trying to sign into my account through this app and trying to what is required of the picture verification, each time it fails. Feels like I’m being asked to play a game before I sign into my account. Very frustrating. I’ve signed in perfectly using the same method on my PC. Guess the app will be deleted from my devices.",Als Dog,Picture Capture Verification does NOT work
1778,False,5,2019-03-04 18:03:16,Really like the app ! Much easier to navigate and to bag item as previously online I often lost items if didn’t sign in first,crioky,Super easy
1779,False,5,2019-01-07 15:38:15,I ordered quite a few items and I loved everything! All fit me perfectly and are good quality. Fast efficient delivery too! Thank you ASOS I’m a very happy customer x,happyever after,Just brilliant!!!
1780,False,5,2018-10-05 22:25:54,"I am in love with ASOS, I genuinely love the products they sell and the delivery system is super fast! I Highly recommend you to purchase delivery premiums as you can get your items the next following day. 😀",mali78600,Addicted to ASOS
1781,False,4,2018-12-07 00:38:01,"Not liking the new wonky filming of clothes. You can’t see them and it’s really off putting. 
Otherwise love the app. Love if you put stuff in your basket it’s not lost later just moved to favourites",Lindsay3107,Filming has changed...for the worse
1782,False,5,2018-05-09 14:36:27,asos is one of the best shopping apps by far; it is super easy to navigate and to purchase through the mobile app and the customer service has always been great.,qhcst,Love love love
