,isEdited,rating,date,review,userName,title
827,False,5,2021-11-25 05:35:04,"I have premium delivery and placed an order this morning which it says will not be delivered until Monday! I like ordering from ASOS because of their next day delivery, if it will now take 3 days why am I paying premium delivery?",Fbshan,Slow delivery
828,False,5,2021-03-07 14:57:43,"I love ASOS, I’m here probably once a month if not more and I appreciate it tends to target a younger, fresher generation but commercial growth and extension of all the brands available must mean that it should also consider the 30-40 women of all sizes and shapes.",buvgg,More diversity in size and ages please
829,False,3,2021-08-14 08:00:30,"I use ASOS for shopping for few years, and I love it BUT in the meantime I changed countries in which I lived, yet there is no option to keep/change the language while I change the location. Many retailers already did it and added this option, why you're so late ASOS?",mxerudy,app is really good but I cannot pick the language?
830,False,5,2021-01-08 08:25:17,"I absolutely love this site because I live abroad, I cannot seem to get many modern things. I probably look on Asos nearly everyday. Ordering is dead easy. I can pick and pay in less than five minutes. Thank you. Asos",Edwina63*,Asos
831,False,5,2020-10-11 19:03:27,"ASOS has regular sales and discounts, so many brands and affordable items. been my go-to for like 6 years for makeup, clothes, shoes & gifts, everything is easy to find on the app and checkout is quick!!",ge0kat,my go-to for 6 years
832,False,5,2020-09-26 19:02:10,"I’ve been using ASOS for years. They not only have a vast selection of brands, their own brand is incredibly versatile and up to date with current fashion. Their student offers on delivery, sales and other deals are also frequently available. One of the best labels.",Etmonas R,Etmonas
833,False,5,2020-09-03 03:07:58,"I’m one of those type of people that do late night shopping, and ASOS facilitates that, however it’s 4am as I’m typing this in my dark mode App Store, because the white background In the ASOS app is blinding. 

Please allow this feature 🥺",farah1214,Great app! Would love it if a dark mode could be activated
834,False,5,2020-03-12 13:28:57,"Options, service and overall layout of the website is both convenient and well designed!",Sexy kitten ,Amazing
835,False,5,2019-12-14 13:14:44,I have used ASOS now for 5 years and have never been disappointed. Delivery’s have been reliable 99% of the time and never had any major issues with returns. Always offer brilliant discounts for students and anual sales. Would shop anywhere else!,BrookieSugarPlum,ASOS is No.1
836,False,4,2020-02-02 09:49:26,"I love the fast delivery option and the great variety of unisex new clothes. 
Still my fav e-shop in the whole world but I almost never buy shoes since the catalogue lacks of half sizes like EU 41 (7.5 Uk).
Also, with the new green courier service, it’s impossible to track down my orders so it’s all a but random...",marycake2019,Not enough EU shoe sizes and difficult delivery tracking
837,False,2,2019-12-16 22:59:04,"Ordered 4 t-shirts on Black Friday to buy as Christmas presents only to find out two weeks later it didn’t process! Items were now out of stock or back to normal price. Tried contacting and took over a week to “resolve” the issue but only gave me a 15% discount on one order. Nothing compared to the sale on Black Friday, asked if I can buy them on the price they were at but they declined. Love the app, just ruined my presents.",StevenLacia,Orders won’t process
838,False,5,2019-01-14 14:52:23,"Recommend paying for the Premier Delivery as it’s really worth it.
Love all the extra features being added like the fitting assistant, different boards for saved items etc.
Very easy to use app with Touch ID for payments, good recommendations and numerous filters.",Scarvorsen,Best shopping app!
839,False,4,2018-05-20 17:40:19,Filtering the price was much easier before when you typed how much you want to spend instead of finding the price in the new system. It takes a while to get to the price you actually want and is quite frustrating. Would be my only criticism.,GohilHB,Filtering the price
840,False,5,2018-04-03 08:53:16,"I received these shoes on time and they were as described. 

Most patent shoes are of a slim fit but was pleasantly surprise when the shoes arrived. I needed the extra width and they are perfect. 

The quality is very decent and you can pay a lot more for these for less quality.",Tosa10,ASOS wide fitting patent shoes size 12
841,False,5,2017-12-18 19:52:28,"One of my favourite apps to order on. Easy to navigate around and ASOS always have a great selection to choose from, always a pleasure ordering from ASOS, customer service is second to none and there £9.95 for a whole premium delivery is quality too.",Holbornatior,Always great
842,False,5,2017-11-14 11:55:38,"The one-off next day delivery payment saves my life! It ensures I can be running late with something and still have what I need in time.
I have a uni ball next week and ordered shoes from somewhere else but they came and they were too short so I rushed to ASOS and I’ll have them tomorrow!",JessicaJohnston,Amazing ASOS
843,False,5,2017-09-14 23:10:11,Fave shopping app. Delivery is amazing free delivery and returns so you can try anything put and if it doesn't work no harm done. I would just like to see the student discount a little higher than 10% as it is on other clothes websites even though it's good that they offer it.,Liviloolabelle,Love!
844,False,5,2017-09-05 00:34:00,Easy to find what you want with the easy to use search and find accessibility. I use these often and the only thing I can say is bad is the delivery fee's but you can't get a yearly subscription and can get free NDD orders for the whole Year! Very helpful.,Myles2707,Great clothing and easy to find
845,False,5,2017-09-04 08:28:17,I use this the app all the time. ASOS literally has everything you need/want all in one place. I can always find an outfit for every occasion. Touch ID checkout makes it so quick and easy to buy items too (not good for my shopping addiction though). Love love love this site.,BeckyPhi,LOVE
846,False,5,2017-09-01 14:57:06,"I use ASOS all the time, very good selection for chaps. I hate looking round shops, as I'm 25 and lazy. The next day delivery is great too. 

This app lets me search easily and I can even add my student discount before checking out using Apple Pay.

If it doesn't fit, return it for free in the bag provided. Easy peasy.",EDLuke246,Great shop
847,False,5,2022-06-10 20:33:52,"Every time you order you have to be careful you don’t accidentally create a klarna credit account. 
Kinda annoying but still love asos.",Lizzie🧚🏻‍♀️,Klarna default payment option annoying
848,False,5,2022-01-10 18:56:00,Been using ASOS for a year now and paid for next day delivery too which is amazing and quick love shopping on the app so many deals happy with all my purchases I’ve made since started shopping with ASOS,landebarber10,Love it
849,False,1,2022-02-13 20:21:54,I’m absolutely gutted to be told my order is not on its way after been told for 3 days that it is … I have zero time to re order anything because ASOS had taken the payment so I did think that my order would of turned up … with the email that I received I had no apology for the mix up and when I tried to talk to somone I had a half assed sorry .. for such a big company I’m disgusted with the service I have received,123786568468,Rubbish customer care
850,False,5,2021-12-16 17:17:24,I use Asos for all my clothes & clothes ect… I love how easy the app is to use & the next day delivery which I’ve had 2 years now. I wouldn’t go anywhere else now. I like how you can buy lots of brands & how easy the returns are also.,Loiswhitxx,Asos
851,False,5,2021-09-22 23:35:34,"I continue to buy from them all the time because I’ve had no issues whatsoever. And if something has bothered me, the problem has been solved straightaway. The app is easy to use.",thatbradybitch,I love this store!
852,False,5,2021-09-04 15:31:19,"ASOS is my savour when I need something in a rush as I am prescribed to the yearly next day delivery scheme when I realise I’ve forgot something for a holiday/party etc, I can order pretty late at night and it still come the next day!",morgypop,A must-have app!
853,False,5,2021-08-27 14:03:53,My delivery is several days late and no notification of when it will arrive. I pay for next day delivery and support staff are useless passing through blame onto yodel.,Angelic_alice,Very difficult to get hold of customer support
854,False,5,2021-07-09 08:12:49,Really love seeing how the models wear the clothes and moving them. Especially in the videos. Such an easy shopping experience… Buy from ASOS at least once a week.,mulabo,"Easy to use, wonderful images"
855,False,1,2021-08-17 15:57:35,How did anyone get In touch with them?? I have been trying for 3 weeks. I sent a return on the 5th July. Confirmation that the return was dropped off. They have acknowledged the return was sent. But now being asked to pay the remains balance from Klarna. So frustrated with the get in touch chat just saying too busy and nobody can help tried all different times of day. But nothing. Can anyone help please???,toon blast no more 😢,Where is the customer service????
856,False,5,2021-04-01 11:59:05,"Products displayed clearly with videos. Information about delivery and returns all on the app, don’t need to go onto website for anything. Useful notifications for returns when received by couriers after drop off.",Kat_trina,MISS KR
857,False,5,2021-03-16 08:42:36,"Quick easy to browse and shop, easy to save products and create looks. 
Some products look very different in person, colour, fit, style, quality which causes a high volume of returns.",Black.Stock,ASOS
858,False,5,2021-02-23 08:23:15,"I love being able to brows new items, easily add to my wish list. Check out and returning items is hassle free. Having local click and collect points is also very handy.",MaxWaffle,Review
859,False,1,2021-03-11 18:06:35,"Please don’t use ASOS 
Customer service is shocking and there no help. I ordered a birthday present for my mums birthday sent wrong products spoke to a custoner adviser who promised would not happen again took there word for it. 2 days late present and guess what wrong watch again. Took £70 out my bank asked me to the order again and I have to wait 5-10 days for my money back. Defo don’t recommend no help.",adamdenston,Took £70 out my account sent 2 wrong watches and no help
860,False,5,2020-10-29 18:38:05,"Always been ahead of everyone on how an app should work, ease of use etc they’ve set the standard for online shopping and continue to improve and stay at the top.",LewyMac2,Brilliant app
861,False,5,2020-07-18 18:06:34,"I absolutely love the ASOS app! It’s so easy to use and with Apple Pay it’s super easy to make a purchase. 

I also love the back in stock notifications when you just have to have everything for that perfect outfit.",Lauraebony,So easy to use
862,False,5,2020-05-20 23:36:17,"Best way to online shop as it has many brands, you can save an item(s) you want for an hour before buying, £10 for next day delivery for a whole year~ which is very useful.",Nicola Louise Leanne,Amazing app!
863,False,3,2020-05-30 00:52:00,"The 20% event on the app is very misleading.  When you click onto the 20% event tab on the main menu, filter down to brand, add to bag and go to check out some of the items suddenly become excluded from the offer.
My wife uses the app a lot and I asked her to double check I was t doing something wrong but even she didn’t understand it.
Best Regards
Pete Bagnall",mancity93:20,Promotional offer
864,False,5,2020-03-27 01:30:13,The app is fantastic because it can scan pictures of products that you want which are similar to the products at ASOS and it does that in one second which saves me a lot of time.,ROM_2003,App
865,False,4,2020-05-09 13:49:23,Dead good for making orders and browsing. I’m really pleased I got the app but the ‘notify me when back in stock’ is a little annoying because it often sends notifications when things aren’t available or when it’s not the size you have selected.,Fleurdeboer,Needs some improving
866,False,5,2020-02-12 20:42:38,I loved to see the products on models within the videos. Highly rate Asos found buying a product more difficult without the videos!! Therefore did not make any purchases when no video for clothes.,PH nickname,Yes videos are back!
867,False,5,2019-12-11 06:24:12,"I bloody lurvvvv this website. It’s a lifesaver with a variety of styles and accessories. Customer Services is amazing and the hours the guys work is brilliant, so no stress to the buyer really. The only thing is that some of the models don’t really sell the clothing...I find this important visually. That’s it really thanks you ASOS",Kala210,As Seen On Screen (ASOS)
868,False,5,2019-11-21 15:34:46,"Always pleased with every order I receive! Amazing delivery service, brilliant free send back service, packaging is great and if you do want to send items back, it’s very
Clever with the sticky strip so no messy wrapping. Highly recommend!",Lucy-Ajde,"Amazing service!! Always quick shipping, brilliant offers"
869,False,5,2019-06-29 18:19:58,"It is the best place for women with curves to get up to date fashionable clothes. Just because I’m a size 18 doesn’t mean I want to wear frumpy uninteresting fashion! Thank you for providing such fashion forward and good quality clothes, shoes and accessories. ASOS is my go to brand anytime I need new stuff. They’re first rate.",Katy_maty,Absolutely love ASOS
870,False,5,2019-06-18 18:15:02,"Haven’t found this to be the best app for purchasing clothes and customer care isn’t great. Took ages processing order for 20% off clothing then unable to process order due to “technical issues” but confirmation received from PayPal regarding withdrawal of funds, so not very impressive.",???butter£££,ASOS app
871,False,5,2018-07-08 19:25:45,"ASOS is my go-to online store for ladies and men’s clothing.... I just wish they did kids then I could shop for the whole family in one place! The £9.95 year  next day delivery is fantastic too and great value. Orders arrived next day even in the heavy snow, I was extremely impressed.",Moneypenny13,Fab online store
872,False,5,2018-04-17 13:03:06,"I love everything I have bought so far, love the Monki range particularly. I enjoy finding something slightly different, the quality is great!
With this purchase I hope I have my size right, however the returns policy is excellent.",Northern Quarter Redcar,Efficient company with wide range of style fashions.
873,False,5,2017-09-29 06:20:34,"I've tried other online clothes stores but for choice, efficiency, ease of use and quick, convenient delivery, ASOS absolutely cannot be beaten. I would recommend paying for premium too. It's changed my life! Although I now have waaaay too many clothes.",d_shaef,Best best
874,False,5,2022-09-07 22:05:01,"Actually really enjoy ordering from this app, it’s great and wish other clothing shops would do the same too :) great 10/10 would recommend",jessj98x,Most user friendly app around!
875,False,4,2017-09-07 15:42:45,"Overall the app offers a great experience, however to give this 5-Stars the experience would be better if the app returned to the correct place after clicking on an item as it often takes you back to the wrong place.",JLSter08,Overall great experience but...
876,False,1,2022-10-14 02:09:51,"i’m a uni student and spent my uni money that they gave us in asos vouchers so i didn’t have to pay for clothes using my own money that could go towards food and basic necessities. Asos then went and banned my account and i lost my vouchers for nearly 3 weeks without an explanation or an apology and i sat worrying for 3 weeks that i’d never get the £150 back that i put towards clothes to last me my time in university. 
do better asos.",ellxodan,awful experience
877,False,5,2022-08-22 15:17:35,Love the videos of clothes so you can see exactly how they will fit and gang when you move. Love the petite section most things fit me perfectly my go to place for shopping !,Rite Petite,Super app easy to use
878,False,5,2022-08-14 21:05:40,"Love this app it is easy to use and the search feature ensures you only browse items you are interested in, saving you time if you want to find something in a hurry.",heyhunz,Great App
879,False,1,2022-07-15 21:25:08,"I’ve been sent an email that my order will be delivered between 6pm to 10pm. I PAID for next day delivery on top of my premium delivery and my item is still not here! 

I’m in London only for this delivery, I can’t wait another day hence why I paid for next day delivery. Now I’m trying to contact ANYONE to see where this driver is and I keep getting redirected to chat bots who keep sending me back to the log in page. I am not a happy customer right now!!!!",Ohema👑,Crap!
880,False,5,2022-06-30 21:43:11,I never fail to find something I like on this site the variety is amazing and it’s my favourite site to visit next day delivery is spot on ... I love looking on here everyday and it’s just such an enjoyable site the choice is just epic,Tuatara22,I love this site
881,False,5,2022-02-10 22:08:19,"The best site. The items are good of quality, never had any issues with my parcel. All the time arrived in time and my items were in perfect condition. 
Thanks, a lot for your hard support 🌈☀️💫🤩",Justmethesun,Good quality
882,False,1,2022-04-20 12:38:20,"I ordered £292 worth of products during the Christmas season and was emailed that it was delivered to my front porch. I never received the products and when I reached to customer service, no action happened. My order was never found. There wasn’t any refund either. Very dissatisfied.

Ordered 2 Fornillo body jelly(ies) and it arrived with their seals broken. Now, I can’t return them because their seals are broken. Very disappointed.",Coleen S94,ASOS deliveries do not get to your door
883,False,5,2022-02-02 11:51:09,"If I’ve ever had an issue with an order, the team have been brilliant and solved my issue really quickly. I highly recommend ASOS to anyone based on the service",EmLouiseJames95,Excellent customer service team
884,False,3,2022-02-07 21:07:15,Dissatisfied I pay for premium delivery and recently next day delivery doesn’t happen. I was sympathetic during lockdown but not acceptable now life has almost gone back to normal. I’m paying the fee for no reason and to add yo my frustration every nickname I give for the review is already used,1d5g,Delivery should be next day if you pay the yearly charge
885,False,5,2021-12-22 00:49:10,"10/10 for app ease of use, multiple options for how you want to pay, a lot of good sales on and promo codes to get that extra 10/20% off on your purchases now and then !",awksjfkwalal,ASOS purchasing
886,False,1,2022-01-16 23:13:10,"I bought size 8 shoes in the black friday sale. i ordered it correctly and everything, the company sends me size 8 shoe back with size 9 shoes inside… they’re evidently too big so i have to send them back. I didn’t do anything wrong, and yet now the company want allow me to rebuy the shoes i ordered correctly at the correct time again so now if i want to get my brother his favorite shoes i can’t due to the price now being too high! </3",Soccerfun⚽⚽⚽⚽👍👍👍,Sales Dont Matter
887,False,5,2021-10-15 03:33:09,"I’m not one for trudging round clothes shops as I’m comfortable doing that. With ASOS I have a wide range of shops and brands to chose from. I’m an older person and have found many clothes that look fantastic on me. Only fault I have is bras need to bigger sizes, I’m a size 14 but with a k size bust !",Jayniec123,Love ASOS
888,False,5,2021-10-03 18:14:41,"Just love how this app is so easy and I had to return something .ASOS made it so easy.
So just purchased some fab things in the sale .Don’t think I’ll go back to the shops !!!
Sharing my finds at work haha they’ll all be shopping here too !!!
Thank you ❤️",Uk Juice,Love ASOS
889,False,5,2021-06-25 20:49:05,"I love the ASOS app. The premier delivery is well worth doing! Returns are easy and hassle- free and the added bonus of free returns make the app well worth having. 
I can’t tell you how excited I am now that Lush products are now stocked too!
Thank you very much!",Ribbonandpearls,Lifesaver!
890,False,5,2021-02-12 08:59:18,"ASOS never fails me. I like the app where you can categorise your specific outfits on the board for holiday , night out etc etc so you don’t get confused during browsing",kesha c-c,Always been my favourite online store
891,False,4,2021-03-16 22:43:26,"Payment wouldn’t accept via Klarna or through use of credit card. When it didn’t show a white screen, it would go black and close the app. Due to this, I have missed next day delivery which the item was needed for.",hanj27,Payment
892,False,5,2020-05-09 12:35:39,"ASOS is simply amazing company to buy off. love everything they have I have only been shopping with them so easy to buy and also return 
ASOS keep the good work going you guys are simply awesome very happy to be your customer☺️🙌",SimplyMev786,Simply amazing ASOS company
893,False,5,2020-04-22 23:48:25,"Very good user interface with very helpful saving features also getting notifications when something is back in stock is a lifesaver 
My go to when buying or browsing for new clothes",jdjdjfhh474738374,Very good user interface
894,False,5,2020-02-10 19:55:02,Loved this app but absolutely HATE that the catwalk videos have been removed. It was one of the biggest reason I bought from ASOS. What an utterly bizarre decision! I personally won’t be buying anything until they are reinstated.,bec501uk,No catwalk videos
895,False,5,2019-11-07 18:21:20,"ASOS app is the easiest app to use and has the best variety, quality and value for money!

Very rarely buy from any other apps/websites for clothes. Not many other places that give such a wide option of both super affordable and high end clothing!",Hayley145,My Favourite!
896,False,5,2019-10-27 13:19:16,Never lets me down and if I need to return things that don’t suit me the process is easy. Also the tall section is so incredibly helpful in finding what will fit me. Would give it more stars if I could.,katie22_,Love it
897,False,5,2019-07-26 12:33:18,"ASOS app continues to just get better making shopping seamless. Most of these retail apps could learn a thing or two from them. So many good features too many to list but it’s one of the best apps, functionally and aesthetically out there. Keep it up ASOS!",NyelleDee,One of the best retail apps out there!
898,False,5,2019-05-27 12:40:10,Super easy to use website massive range of clothing for all occasions always end up coming back to ASOS discounts are always good too. Only downfall is delivery company used claim you’ve signed for goods you haven’t received so id always say best to deliver to a shop where possible,ruru7891,Great app
899,False,3,2019-01-17 10:48:51,"Would be 5 stars. Great app with easy checkout. Best fashion retailer app by far. Yet it continues to crash a couple of times each time I use it. Only way to rectify is to restart the app - meaning I have to scroll down hundreds of items if I really wanted to go back to where I last was. 

If the random crashes were fixed - 5 stars easily.",Beyoncefan17,Would be 5 stars... but...
900,False,5,2018-11-21 14:25:25,"I love the new fit assistant which lets you know what size you’d be based of your details.
However I think itd be a lot more accurate if you’d be able to put your waist/bust size in also to make the sizing a little more accurate",Libbyhbb,Love new features!
901,False,5,2018-07-21 11:49:01,"Really well made app, super easy to narrow your search and it recommends clothes that you’ve viewed previously which is cool. Really good interface. The only request I have is to be notified when certain clothes are back in stock, otherwise spot on",Milky Toe,Great app
902,False,5,2018-06-04 20:00:27,"Always order from ASOS & it’s just getting better and better, always getting perfect service, perfect delivery perfect items so much choice always recommend Asos, never go to high street shops anymore so much easier online! Thankyou so much Asos",c7864,So impressed
903,False,2,2018-06-28 07:57:36,"Had to reset my account and still waiting for the reset link 20 mins later ( I’m shopping now not later) 
I found it quicker to just sign up again.
I then had difficulty adding item to basket. A message kept popping up saying item can not be added. Miles away from competition however search engine very good and responsive..... Can’t even submit review because my nickname is taken!!",ihall5,ASOS
904,False,5,2022-01-30 14:21:21,I’m 5’2” and to find clothes especially jeans that aren’t too long is very difficult. ASOS has a wide selection of clothes for petite women that are up to trend and fashionable. They are true to size and good quality.,mummypetite,Great place to shop for Petites
905,False,4,2017-09-29 08:11:26,"Asos always has a great selection with a good range of prices, fast delivery and it's really easy to find what you're looking for. My only issue would be that sometimes there's almost too much choice and it takes ages to scroll through, but that's not really a complaint!",Katbox12,Great website
906,False,5,2021-07-10 07:27:09,"I have been using ASOS for over 3 years now and I honestly haven’t had better quality clothing from anywhere else , their products are amazing and they look after their customers well! 
Thankyou ASOS x",77hjs,I love ASOS !
