,isEdited,rating,date,review,userName,title
319,False,1,2022-09-26 16:40:24,I am not happy with asos I pay for next day delivery however that dosent happen all my  parcels just come as they please I have orders on  next day delivery however the never come next day never happens delivery driver  lies  and say they will deliver  but it never happens when I order it may be for an occasion which is way I pay for next day please don’t say and ask people to pay for next day if you cannot deliver the service. Please speak to your dellivery deliver to stop delivering when the feel otherwise sack them and employ delivery divers that do there work probably .,wow 20,Bad delivery service
320,False,5,2021-10-16 08:28:49,"It would be a good idea to give people a chance to write their reviews. As you a solely online retailer, it really is a must for your business. Most models are not representative of the average shaped person out on the street and also the fabric quality of an item is also something very hard to judge from the screen.",Kaleytrea,Reviews Section
321,False,2,2022-06-25 13:35:40,"Blocking hundreds of customers from there account is not a reason for solving returns issues. I have returned items that are not what I ordered, poor quality, wrong size and don’t suit me. Are these reasons for blocking loyal customers from accessing there account? Maybe you should be finding out the reason why they are returning and notifying customers that your going to block them from using your website before hand, although I think this is appalling behaviour of a retailer.",elephant297,Really Bad Customer care
322,False,1,2021-12-08 20:30:08,"I ordered and payed for priority next day , my order was for a ball gown , to wear three days later . The items didn’t arrive and they said it would be a week later as the carrier missed the item ??? So re arrange for the next day , at least it would only be one day later . Chat cut me off then no one was available , email no answer , no phone number stuff out of stock and rubbish customer service , pay for a service and don’t get it . Won’t be using again .will be getting a refund for the priority next day to . So disappointed",nutsy99,Don’t pay for priority next day
323,False,2,2021-10-22 08:56:06,"Doing a long order and half way through the app wants me to sign in AGAIN losing all my basket items. Once I’d chosen my items and requested next day delivery, one item couldn’t be delivered (next day) yet no option to cancel that item off the list at that point. You have to go fully back into the basket, find the right item and cancel it. Then you go back to pay and have to remember to click next day again. You could easily forget this and miss out on next day delivery.",mattmanch,Needs work.
324,False,5,2020-08-30 00:50:42,"Use Asos for almost all clothes and shoes. Just got two new pairs of jeans and some boots in the sale. Service is good, selection of styles and brands is amazing, prices are excellent.

The new app itself works well, allowing all the same functions as the full desktop site. It has a nicer design than the old app and the navigation seems to make sense. Can't think of any complaint to make, tbh.",Captain Rock Nock,"Great site, great app"
325,False,2,2021-05-16 20:33:35,"Excellent selection of clothes but the website really plays up and has multiple glitches. For instance, on several times it has not recognised my password, asks me to reset it, when I go on the reset link it tells me the reset link has expired only to then accept my OLD password on a different device. Another time my order did not appear on my account so I could not process a return. Customer services were not helpful at all. Shame really as I like their clothes.",MummiMimi,Great clothes. Crap website.
326,False,5,2020-01-30 10:22:04,I have been using the ASOS app for a while and I can’t fault it. The search options are great and the recommended size really helps to avoid unnecessary purchases. Ordering is easy and the variety of payment options including buy now pay later is great to avoid paying for items you may return.,Hobba80,"Easy searching, ordering and great payment options"
327,False,5,2019-05-30 09:03:04,"Easy to use interface, Create your own wishlist from a range of fantastic reputable brands. Love the Apple Pay function of just taping your thumb away with purchases, Discount Coupons are always available up to 20% off everything! Only small criticism would be to keep an eye on selected items and sizes as items will just be there without any stocking up.",Beastly Chocolate,Versatile Shopping App!
328,False,5,2020-07-28 07:42:04,"Just love how easy ASOS is to navigate, everything is laid out and easy to filter through on the menus, for some great stuff on here that I haven’t seen anywhere before, sometimes it can be hit or miss with the ASOS home branded clothes but pay £4 for a T-shirt it’s not gunna feel like Gucci, there’s multiple payment options for all types of budgets also.",minxerincer,Love this app!!!!
329,False,1,2018-06-07 17:27:57,"Extremely frustrating when you’re sent notifications on sale items or themes of clothing via the app. You scroll through hundreds and hundreds of items and add items , you try to pay online it doesn’t let you , you log into the app and all your items have disappeared and the items you added to your basket online have over ridden the items you added via the app. 
Doesn’t allow you to see the items you’ve viewed on the app like it does the site and you have no way of remembering the items in your basket. 

RUBBISH !",MzUnderstood22,doesn’t sync with your online account
330,False,5,2017-12-25 23:49:51,"Although some of the clothes are obviously aimed at a much younger market I always manage to find clothes I love.
I have more ASOS clothes than any other brand.
The sizing is always pretty good and I like that they offer a good choice in their petite collection.
Their sales are fab and today alone I’ve picked up 4 dresses for just over £40! It’s nice to have clothes that not all of my friends are wearing too.",Ninelivesemma,What’s not to like.?
331,False,4,2020-06-12 13:12:06,"Having to order the same items again as the last order I paid for never arrived and still haven’t got a refund even though the order tracker shows it never reached the counter I have to wait for them to investigate their screw up even though they know they’ve taken care my money and that I didn’t receive it, absolutely appalling! I also paid for next day delivery",whibsu,Terrible customer service
332,False,4,2020-06-09 13:30:37,"As ASOS has gone paperless with the new app functionality, I think having a search function in the return tab would be great! As sometimes when you return you have to look for the order number and having a search at the top makes it easier. You can search your order number. Other than this I love the app and it’s great! Thank you",Maryam4437,Love the app but without Search functionality in the return
333,False,5,2021-03-01 17:50:09,"My first choice for shopping..mostly find what I’m looking for, they do nice discounts also when something isn’t available you can get alert when it comes available (normally it always comes back and notifications very good) definitely the best online shopping you can wish for.",Monicavf13,ASOS shopping
334,False,2,2022-11-16 20:23:30,"First time order was given 20% discount. When placed order the free delivery option was removed so had to pay postage, meaning the discount on original price was less then 5%. Due to entering card details slightly wrong the order didn’t go through. Tried to reorder but wouldn’t let me use the first time order option anymore so ended up paying full price !  Waste of an hour but still made a purchase so hopefully the coat is better than the purchase experience 😤",molly126838,First Impressions Count
335,False,3,2021-08-04 16:45:10,"I’ve just gone back and forth with customer service as returned don’t update to tell us when they’ve been received. I’ve been waiting on this so my klarna would be updated, but nothing happened until I chased customer service to find out if it had been received. Who were extremely unhelpful. Please fix return status to be accurate so I dont have to chase CS everytime.",fiamete,Order doesn’t update when return is received
336,False,1,2021-07-08 00:12:07,"Don’t get me wrong guys I love ASOS until the time that they suspended my account, I did not justify it. Just to make a long story short I have been a customer for more than 8 years, with my influence I brought many others! Ordered very very  often since I become ASOS, during the pandemic they have made few “mistakes” on my last orders was always missing items, so I made complaint to get the refund 2 times they gave me the refund, there was a 3rd time that they didn’t give me no refund and lied to me saying that they are processing the refund. Then suddenly they suspended my account????",enzo balde,Mr Mansur
337,False,5,2020-12-14 21:19:28,"I am obsessed with ASOS, particularly the ASOS Design range - every item of clothing I’ve bought has been so comfy and always good quality. It’s so affordable for anyone and it’s the best quality range of clothing I’ve ever bought! I find myself scrolling through the app everyday to find some more bargains. Couldn’t recommend ASOS anymore if I tried!",Jesyjane24,Only place I shop!
338,False,1,2020-10-23 12:38:45,"Terrible service. Ordered premium next day delivery for a year and checked the terms and conditions for the cut off time as I needed a parcel for the next day. The terms and conditions state 23:00 - I purchased and ordered at 20:45 only to receive a text the next morning saying my order would be delivered the following day.. so it’s not next day. Turns out cut off time is now 20:00, which is not in the terms conditions, nor does it come up upon checking out. When I contacted someone through the live chat option, they said the cut off time is 13:30..what a joke.",HREmm,AWFUL
339,False,1,2020-10-01 20:05:59,Each time I order it says that something went wrong and order unsuccessful. Yet gives absolutely no inclination as to what the issue is. My first initial order was in time to receive next day delivery for Friday. I was not informed that my order was unsuccessful as it initially did not say. Only when I just checked my bank account did I realise the payment had not left. I reentered your website/app only to find it was unsuccessful. I have now missed the ability to receive Friday next day delivery now as it is too late. And your app still will not inform me why the order will not be successful. Horrendous.,jaiandoanaoqowoinndlspwonbe,Awful
340,False,5,2020-06-23 01:49:37,"ASOS has not only a diverse selection of clothing and accessories but they also have an unrivalled returns system and policy in place. The website is flawless. Finding any specific item or brand couldn’t be easier, plus it’s an absolute dream to navigate. 
Well done ASOS...I can’t see myself going to the high street very often at all since purchasing items from yourselves. 🤘",Tecca83,Tecca83
341,False,5,2019-10-30 19:17:09,"Not as good as it used to be. Changing cut off times because of busy times?! What’s the point of last minute shopping with ASOS next day delivery when it’s no longer next day?! Told all my friends to get this now l look like an idiot, you’ve all of a sudden changed your T&Cs with no notice by the way! Only finding out when your items are late :/ ooofff what are you doing ASOS?!",MissNomaa,Next Day Delivery
342,False,3,2020-02-13 12:17:03,"This app would be brilliant if this one criticism could be acted upon. When trying to return an item, the only option that automatically appears is for the customer to ‘drop off’ the parcel somewhere. This is awful, given that there are numerous ways to return orders (ie Hermes collection). Why does this option not appear on the app or your website? I spend ages trying to find the Hermes courier option! It’s such a turn off. PLEASE do something about this soon?!",pablobrad,A great app spoilt by poor returns info
343,False,5,2019-09-28 06:24:54,"Amazing app, makes shopping so easy, even easier than the website. I especially love the Favourites function, to save things you like and transfer them straight to your bag when you’re ready to buy, and that you can set alerts for when your size becomes available if it’s currently out of stock.",Callie-Mae,Shopping couldn’t be easier!
344,False,5,2018-11-03 08:01:38,"I feel like other high street shops/online are more strict with their rules and they’ll try to find any excuse to refuse a refund, especially when items genuinely become faulty. 
ASOS is different. They go the opposite and even refund when I once returned (kept forgetting to post back) post 30 days. Without question. 
It’s sad the rewards scheme has ended because I loved that! 
Love the unlimited next day delivery for £10! So worth it. 
All the shops in one place. The website is easy to browse with the search panel that works well and finds exactly what you’ve typed. The filters are the best out there. And again, actually work. 
The app is great with no glitches. 
A**** shopping every time.",Eolk1,Always the best
345,False,3,2019-07-17 07:02:18,"Tried using Apple Pay but it was kept saying shipping address is missing despite after entering click and collect location.  Later tried to checkout using card directly, the address finder is not accurate. The traditional postcode based finder was much accurate and easy to use but this address finder is hassle,  it returned only my neighbourhood address after that I had amended and eventually  did check out.

Address entry UI is not very friendly.",techiearun,"Good app, but Check-out is hassle"
346,False,5,2022-01-19 08:58:42,"I’m plus size and it’s hard enough trying to find clothes but I would appreciate some categories for us chunky .
I can find what I want easier rather than having to use the filters. For this reason this is why I have given one star. The second I get me some categories I’ll change it xoxo",Chery_x,Categories
347,False,1,2022-04-26 19:17:46,"So I ordered a medium pair of North face shorts to be sent a large pair inside a medium labelled bag. I send them back and have to wait 10 days for my refund in the mean time I order another medium pair which I paid for next day delivery. Then they arrive and guess what it’s another large size in a medium bag! What awful service! Is this some joke. Now you owe me £80 which I have to wait 10 days for! 
I won’t be ordering again. Lost complete confidence now. What are you going to do to resolve this issue and what compensation are you do to make it up to a very unhappy customer?",grrrr! 123456,Terrible service Asos!
348,False,5,2021-06-08 19:38:44,"It would be great if when browsing, it would tell us somewhere on the page of each item if we have purchased this already in the past! As there is so much variety I often find that I order something I already have or may have returned previously.",Shynaaaaaaaaaaaaaaaaaaaaaa,Great app but 1 recommendation
349,False,5,2020-12-27 11:01:39,"I have no complaints about the ASOS app. 
I’ve been using it since it came out and I love it. They have been there with me through thick and thin, whether it’s from underwear, tracksuits, coats, New Year’s Eve outfits and handbags, it’s just perfect, everything always comes on time, everything always fits and everything always looks fabulous on! I love it!",Mazzle142,My life
350,False,5,2019-02-13 14:55:02,"Me being me and not knowing how to change my billing and postal address, I had problems using the app at the start. Once I figured it out I cancelled my order and re ordered it the right way! Very grateful the gift card I used was refunded straight away and happy to hear the money if taken from my account would be reimbursed within 1 week!",ee tvrhe r,Would use again
351,False,5,2018-10-04 12:07:50,"Asos never ever disappoints! And if there ever is an issue they are so quick and efficient at resolving it.
I buy from here a lot...probably too much looking at my bank account! I especially love their own branded clothes, great quality and great price!

Personally I’ve not found a better website than this and I religiously look here before anywhere else!!!",Tink 7891,Favourite website ever!!!
352,False,5,2018-05-09 19:27:11,"I love using the ASOS app, it’s so easy to use, just put in what you want then refine your size and colour, bobs your uncle up comes a list of whatever you can choose from. If you can’t make your mind up what to have, pop into the saved items until your ready to narrow your selection down to one or maybe even two items. See how easy it is !",Ang 1111,To dress the best you need ASOS
353,False,1,2018-08-30 20:18:55,"Ordered £400+ worth of clothes, no arrival on the date they specified - I then get fobbed off by the first customer service agent who lied to get rid of me, and then told by the second agent I contacted that the package hasn’t even passed to Royal Mail. My only options are to get a refund or wait 12 days (!) for it to be redelivered... no compensation, no ability to get it to me next day, no appreciation that not only is the service incredibly poor, but I was lied to during the process, no actual resolution from ASOS just passing the problem back to me to order again or wait almost another 2 weeks. Shocking.",R2307E,Shocking customer service
354,False,5,2022-07-16 14:11:00,"Been buying from Asos for 6 years continuously from them, winter, spring, summer and autumn wardrobe filled with merchandise from asos. Returns are quick and free, specially with drop and return or collect from shop options are huge and always finding a shop nearby. Next day delivery for a steal price. Will retire with Asos 🥹.",Încercat,The absolute most used shopping app I use
355,False,4,2017-09-03 08:35:13,"Main way I browse and shop asos - sometimes annoying that when you click back to the page of products after looking at an item/going out the app it can take you back to the wrong place.

Ideal build to the app would be for you to be able to bookmark within a product page and return to where you'd scrolled to even if you've left the app.",Whatever5378941,Use it all the time
356,False,5,2022-02-05 16:34:24,Can’t fault Asos. Brilliant return policy. Great updates on delivery etc. if something isn’t in stock you don’t have to click on the item to find this out (only when you put filter on for your size) saves time. Like the ‘find something similar’ feature in saved items.,absapy,Always good service
357,False,4,2022-05-10 23:20:39,"If you want a new look, this is the app for you, with new models and nice quality products for a budget price, I recommend this to anyone who wants to switch up to any kind of fashion. From classy, to sportswear to even lounge wear. Great app made many purchases and intend to do more. However I have not able to have gained my access to student 10% discount after applying.",Bobbyshepherd:),"Good looks, quality app"
358,False,4,2022-03-12 13:59:08,I have recently had an incident where I tried to order this dress 6 days prior to the day I need it for and the order was unsuccessful. Then I tried to order it yesterday again and the order was unsuccessful. I was told by customer service to log out and log back in but now I need to pay £4 more for a next day delivery which is ridiculous,naomi-079867564534,Really nice clothes however…
359,False,1,2021-11-27 19:44:47,A customer pays for a year premium delivery and do not get the items contacts customer service and gets spoken to rudely! Then gets told that it will be sorted out within 48hours!!! Still no help you contact them again then you get told the items are not out of stock so it will be replaced only for you to get an email stating that the items are out of stock and your money refunded! Not only are they unprofessional they lie just so they get you off their backs!!!!! Not a great service at all! You can definitely do better “Ezekiel” can’t remember the other guys name!,Cornelia Gbormittah,Orders
360,False,5,2021-05-08 18:32:39,Nice collection and price but most annoying thing is you're choosing the items and after few minutes when you are going to check out the bag is empty again and again you need to select them again what a time waste.,Wax love,Empty bag after few minutes
361,False,5,2021-01-22 11:05:28,"Why Asos is great:

-premier delivery is the best and the most convenient! Next day delivery every time!

-wide range of clothes from plus sizes to petites which is great because I'm petite, it's hard to find clothes that fit me. 

-they have different brands on here, both designer and high street. And their own has also got some amazing pieces. 

-the website/app is nice and simple and also trustworthy. Checking out is a dream (but also dangerous because you end up being to familiar with the checkout button)

-returning is as easy as pie!

Honestly the above is automated but they right! I LOVE ASOS, returning is easy, navigating is easy, and buying is easy (so easy it’s dangerous tbh hahaha)",aszhleynicole,Asos is brilliant!
362,False,5,2020-12-30 13:07:54,"An extremely large choice of products including clothing, cosmetics and gifts... Fashion forward with great classics and always keeping up to date with new exciting garments. 
If I’m not shopping ASOS own I’ll use ASOS to purchase my other favourite brands as their sales and promotions are definitely worth it and always about. 
I enjoy their “responsible edit” of clothing ♻️ , collaborations with other artists, all inclusive range, useful apps- QR scanning and camera product recognition. 
If on the rare occasion I’m not satisfied with what I’ve ordered the return process is straight forward and hassle free which is ideal. 
All in all a 10/10 from me. 
Best retailer out there. 
💯",R Emmet S,10/10 🌟
363,False,2,2021-01-03 11:11:16,My app crashes a lot and logs me out just as often. They have also decided which products you review with their new review feature. There are products I’ve ordered that I would like to review but I have only been sent the links to the products that have gone down well. Overall quality of products has gone down hill every year but they are very size inclusive and the only place in the UK I can buy shoes in my size,9876543210-1,App crashes and they select which products you review
364,False,1,2021-01-02 13:58:58,"Used to be great but just got too big and don’t care anymore. Ordered a bag in the sale, 3 days later get an email saying out of stock and will refund. But it’s still on sale back at full price, and still no refund. Bought trainers that are wrongly sized, want to exchange for a smaller size. Won’t do that because they don’t have the manpower in the warehouse. But I can reorder the smaller size at a higher price and they have the manpower to do that! No complaints procedure advertised or access able on website. Just awful these days I’m afraid.",Nsil5,Awful customer service
365,False,5,2020-12-13 17:58:14,"My favourite go to website ASOS! Fabulous range of brands to suit every pocket. I have premier delivery which is real value for money and my goods arrive next day by either DPD or Hermes. There have only been a couple of exceptions, Black Friday sales was one where delivery was a day later but completely understandable. Great site, highly recommend it",Zub427,Everything on one site
366,False,5,2020-08-05 23:42:57,"Like that you can easily search, suggestions are pretty good. Can even search a photo for similar items. They send discounts through notifications (sometimes like a 2hour sale so godda be quick!) but overall easy to use. I like that they have different styles - I’m a bit of a girly rocker so.",Pinkowicz,Great - a little too easy 💸
367,False,5,2019-08-29 22:16:19,"Just the best shopping experience ever. ALWAYS find something suitable, purchasing couldn’t be easier and the same goes for returns! Fast, efficient return service and the money back into your account within days. I don’t bother shopping anywhere else now and with the premium next day delivery who could ask for anything better! Thank you ASOS ❤️",butler_s,Lots of love for ASOS
368,False,5,2019-05-30 22:31:35,"I have bought many sexy dresses for my wife from ASOS over the last few years and we are pleased with all of them, the modern fashions are amazing, and although we’re not youngsters anymore I still want her to turn heads, look glamorous sexy and drop dead gorgeous and she certainly achieves that and easily, she looks incredible in all of them, phew is it getting hot in here or is it just me 😉😜😚😚😚😎👍🏻👊🏻👊🏻👊🏻",Animal2258,Mark G
369,False,2,2019-07-07 20:57:32,"My previous uses of ASOS have been positive. 

However, a few weeks ago I bought the ‘Next Day Delivery’ package for a year, and since I have been very frustrated by their service.

My last two orders arrived in 3 days rather than next day, with Hermes saying I was not in to collect the package, which was untrue (with one of the orders meaning I stayed in 3 extra hours to receive it, but it never came!).

ASOS are saying they can offer me no reimbursement because they cannot amount for delays by their delivery partners. However, if I pay £9.95 for a service that does not do what it says, I expect reimbursement for that service!

I am very disappointed and frustrated by their dip in standards. 

However, the clothes are of good quality, and there is always a good range to choose from, and good sale sections.

Improve your delivery service and this would be a 5* review!",naynaynarina,AWFUL delivery services
